,series,episode,character,lines
0,TAS,episode 0,MCCOY,"If its pull is this strong, Jim, how do we get out of orbit? It's a starship like nothing I've ever seen. The size of it. Barely an instant in eternity, Jim. Must have been some accident to get almost every pod. Gives me the creeps. I feel like something's watching us. You mean we're trapped here? No communication, nothing? Jim, the door. What is it? A message from three hundred million years ago? Hurry up, Spock. The force field of his belt won't hold that weight for long, Jim. Jim, you don't think that's going to help us? Whatever that thing is, it survived millennia in a dead hulk. All it has to do is outlast us and just take over."
1,TAS,episode 0,GREEN,"You are correct, Captain James T Kirk, and I have the starship I've waited for so long, so terribly long. You will now remove the static shield from the navigation console, Captain James T Kirk. All nonessential systems are extinguished. You will obey me. Obey me! Obey me! Remove the static shied from the warp drive controls! Do it now! Repair the warp drive controls. Obey me! You will leave this orbit and plot course to galactic coordinates zero three six point two three one. Complete repairs! Obey me! That is correct. You will activate the manual controls. Obey! Apply full power! Obey me! No! Accelerate! Do not destroy the ship! Obey me! Obey! Obey! No! Don't! Please, don't! Don't leave me alone. Please, please. So lonely. Captain's log, stardate 5221.8. Final entry. Resuming outward course beyond the farthest star of our galaxy. Mission, starcharting. <Back to the episode listingStar Trek ® and related marks are trademarks of Studios Inc. Copyright © 1966, Present. The Star Trek web pages on this site are for educational and entertainment purposes only. All other copyrights property of their respective holders."
2,TAS,episode 0,SULU,"She's not answering the helm, sir. Two minutes right ascension off course and drifting farther, Captain. Standing by, sir. Captain, we're still gaining speed. No good, sir. We're still falling toward it. Aye, aye, Captain. Aye, aye, Captain. Aye, aye, sir. Yes, sir. Good work, Mister Kyle. I thought we lost them when we were cut off so long. Bridge to Captain Kirk. Something's activating the ship's phaser banks. They're locking on the alien starship. Phaser banks were off, Captain. They activated themselves. No, sir. That's the heart of the galaxy, Captain. Captain, we're dropping out of orbit! We're falling into the dead sun."
3,TAS,episode 0,KYLE,"Ready, Captain. Located them right after that explosion, Mister Sulu. We're locked on and beaming them aboard. Piece of cake, sir. Here they come now. Captain, something's beamed aboard with you."
4,TAS,episode 0,ALIEN,"Danger. Danger. The dead star, we are being drawn to it. Rather than carry this malevolent life form to other worlds, we have decided to destroy our own ship. There is no other answer. If you understand this message, you are protected only for this moment in this room. This thing it wants"
5,TAS,episode 0,SCOTT,"We've picked up speed, sir, rapidly. I've cut back power, but we continue to gain momentum. Would you look at this now? This metal, it isn't cast or rolled. It was drawn into filaments and spun. Aye, from the inside, from the looks of them. The structure of the ship, those huge arches, thrusting up. The whole ship is designed to receive and store energy. I feel it too, Captain. We can cut our way out of here. Something to shield this room. But shield it from what? But nothing, no form of life could survive three hundred million years. No damage to hull or engines, Captain. That alien commander, sir. The message said that they had to destroy their own ship. Aye, sir. It's no use, sir. The mechanism is frozen. They've already tried. I thank you, sir. Sir, we cannot get into the core. Drained of all energy, sir. Aye, Captain. Auxiliary controls ready to activate, Captain."
6,TAS,episode 0,KIRK,"Situation, Mister Scott? Mister Sulu? Stand by to reverse course. Reverse course. Why aren't our sensors picking it up? Forward scanners, Mister Sulu. Full reverse thrust. How much time do we have? Sulu, flank speed ahead. Our only chance is to try to get into orbit around that thing. Steady as she goes, Mister Sulu. Maintain orbit. Slingshot effect, Mister Spock? Do we have enough power? Put us alongside, Mister Sulu. It's been damaged. I'll bet she was pulled in like we were. You're sure, Mister Spock? Can you identify that metal, or the design of the ship? A civilisation that advanced three hundred million years ago before life even emerged on Earth. Mister Spock, any indication of that ship's power source? We'll board her, Mister Spock. Scotty, Bones, you'll come with us. We'll need life-support belts. Mister Sulu, have the Transporter room stand by. Activate life-support belts. Energise. Like a spider spins his web. Look, every pod, they've all been burst open. Kirk to Enterprise. Lieutenant, are you still getting that radio signal from this ship? All right. Lock on us with the transporter and be ready to transport. We're going inside. What do you make of it, Spock? You mean it's functioning after all the milleniums this ship has been here? Compared to the beings that built this ship, we are primitive people, even you, Mister Spock. All right, let's keep going. Tricorder analysis, Mister Spock. Enterprise, do you read me? Sulu? No energy registering. Something's drained them. For the moment. This is, was, the control centre of the starship. These must be control and navigational instruments. Will it hold? I'm not sure, but I think It could be a ship's log or a warning. It seems to keep repeating. Anything? Get out of here! Hurry! Transport it back out. Status? So, we're all just fine, but whatever was on that ship used our transporter beam to come aboard with us, and now it's here. Until we learn more about it, Scotty, perhaps we should be ready to do the same. Take two of your men and arm the self-destruct device in the Engineering core. Mister Spock, any change in ship's readings? Like the beating of a heart. Bridge to Sickbay. Bones, get down to the Engineering core on the double. Get on those life-support systems now. Override systems, Mister Spock. Open the core hatch. All right, get the cutter beams on that hatch. Move. And mutual override did not work? The cutter beams. Spock, can you rig a low-frequency shield like the one on the alien ship, on our navigation console? Do it. Do you get a magnetic flux reading there now? No. It must be held by the magnetic force of the dead star, and it needs a starship to break free and a crew to man it. You have shut down life-support systems and endangered members of my crew. Restore those systems first. And if I refuse? Stop! You'll hurt him. I'll obey. Let him go. Mister Scott, start repairs. Install the auxiliary controls. What are we dealing with, Spock? A slingshot effect to yank us out of orbit. Can you compute it in your mind? If we try to use ship's computers The engineer will need aid from my first officer to complete repairs. Is that permitted? I guess it is. Plot the course, Mister Sulu. I'm aware of that, Mister Spock. The auxiliary warp drive controls can only be operated manually. Controls activated. Standby to activate warp drive unit. Activate warp drive! Is it gone?"
7,TAS,episode 0,SPOCK,"I can only describe it as hypergravity, Captain, more powerful than any we've ever encountered. It's dragging the Enterprise toward it. Negative star mass. Spectra analysis, imploded matter, but every reading on it is negative. Impact in ninety three seconds. Ninety two. Ninety one. Forty seconds, Captain. Thirty nine, thirty eight. Nine seconds. Eight, seven. Orbital velocity. I'll need some time for the computations, Captain. Confirmed, Captain, but it isn't possible. That ship is dead. Temperature is absolute zero. There is no thermal reading to support life aboard her, and no energy store to send radio messages. Nothing except a slight magnetic flux reading which could be normal for the ship's metal. Probability point nine nine seven, Captain. Negative to both, Captain. Unknown alloy, harder and lighter than any registered metal. It is not a recorded galactic starship design. Retro analysis of the ship's spectra dates it as having been in orbit here for slightly more than three hundred million years. No, Captain, but this far from a G1 star, it is logical to assume they had some kind of warp drive. The hexagonal shape of the windows suggests a similarity to natural insect designs of Earth, the honeycombs of bees. The individual cells are shaped precisely like this. A lighter and stronger material than anything we have now. Accidents seldom have such system, Doctor McCoy. I believe we must consider the alternative possibility that the crew of this ship destroyed her themselves. Captain's log. We have beamed aboard the alien ship found orbiting a strange dead star. The Enterprise is recording all data for the log and a full report later. Captain, its registering energy. Very little, but building. The wands are accumulators, receptors to attract energy, motion, sound, light, heat, every kind of energy around them. A physiological symptom of latent primal superstition, the fear of primitive people confronting something unknown to them. Artificial gravity is in effect here, Captain. Both air and gravity within two points of Earth normal. No use, Captain. Some sort of interference has been set up. The source of the interference is here, Captain. It's not part of the normal equipment. It's like something they jury-rigged during an emergency. Possibly from whatever had come aboard their ship. Quite right, Mister Scott. No known form of life. Something is trying to get in. The field of interference is reacting against the magnetic flux lines, Captain. If the energy stays at that level. It is possible that this much of their technology survived. I may be able to get a translation. Patience, Doctor. Automatic bridge defence system on and prepared, sir. We're registering a slightly higher than normal magnetic flux. Not dangerous, but the level isn't constant. It seems to fluctuate, a steady, almost pulsing rhythm. Trouble in the Engineering core, sir. Something's jammed the circuits. They're magnetised. Exactly like the Engineering controls and the life-support systems on decks five and six. Power out on all but key levels, Captain. High magnetic flux reading. It would have a very small field. It's activated, Captain, but only an area three metres square. Negative, Captain. It has absorbed the memory banks, Captain, all of them. Captain! No, Captain. I'm all right, Captain. High rank probabilities, Captain. It is a magnetic organism without mass, but capable of symbiotic relationship with a host body, a starship for instance. It is a form of primal energy, and it can utilise the electronic control systems of a starship like the mind of a man uses the neural control systems of the human body. It has become the Enterprise, and we are only life-support organisms in its body like the white corpuscles in human blood. And Captain, the magnetic flux readings are higher. It is growing stronger, building itself. The alien will know. I believe I can, Captain. I will need to aid Mister Scott. Captain, this symbiont can reproduce itself by mitosis and take over every starship we encounter. It can control computer centres, whole planets. Activated, Captain. Affirmative. It fled the ship when it thought we would crash into the dead star."
8,TAS,episode 0,UHURA,"Captain, that's the source of the radio emissions. Captain, there's another signal. Listen. I'm getting that radio sound again, sir. Nine seconds right ascension from galactic plane, dead ahead and closing fast. It's on the viewscreen now, sir. It's coming from that ship, Captain. It's beautiful. What kind of people could have built it, to touch even a starship with grace and beauty? Enterprise. Lieutenant Uhura here. Negative, Captain. It stopped transmitting when you beamed aboard. Transporter beam on and locked. Standing by. Sickbay reports no injuries to crew, sir. Bridge, Lieutenant. What? Captain, decks five and six report shutdown of all life-support systems. They've gone to life-support belts, manual override is not responding. Sir, Cargo holds three, four and five just shut down life-support systems. Captain Kirk, the ship's computers. Something's going through every storage bank. It seems to be taking control of the whole ship."
9,TAS,episode 0,ENGINEER,"Yes, sir."
10,TAS,episode 0,CBS,
11,TAS,episode 1,MCCOY,"Who's he, Jim? Afraid I don't, Jim. Oh, I thought sure you'd know Thelin by now, Jim. He's been your first officer for five years. Well, well, well. So you two finally got back from your vacation. While you've been running all over Orion's creation, I've been running the annual crew physicals. You're the last ones. Never mind the chit-chat. I've got my medical scanners all set up for a Vulcan. I have to recalibrate every time I run a physical on you, Spock. What's that supposed to mean? If that was supposed to be a joke, Spock, I have to remind you Vulcans don't tell jokes."
12,TAS,episode 1,GREEN,
13,TAS,episode 1,SULU,
14,TAS,episode 1,KYLE,
15,TAS,episode 1,ALIEN,
16,TAS,episode 1,SCOTT,"Enterprise. Aye, sir. Captain, I was expecting there to be one of the historians with you. But a Vulcan? Sir? Two to beam up. Aye, sir."
17,TAS,episode 1,KIRK,"What a trip, Bones. Orion, at the dawn of its civilisation. Even just observing, not touching anything for fear of changing some piece of history. What's the matter? Bones? What do you mean, who's he? You know Mister Spock. Kirk to Enterprise. Beam up. Explain yourself, Mister Scott. I don't know what's going on, but the first officer of this ship will be treated with respect. Who are you? No, but if it's reality, what happened? Captain's log, supplemental. When we were in the time vortex, something appears to have changed the present as we know it. No one aboard recognises Mister Spock. The only answer is that the past was somehow altered. But something was changed. But I know who you are, and no one else aboard does. While we were in Orion's past, the time revision that took place here didn't affect me. Kirk here. Your findings? It is in this case. If we didn't change anything while we were in the time vortex, someone else must have. Was the Guardian in use while we were gone? Was there any notation on the death of Ambassador Sarek's son? This cousin, what was his name? Spock, did Selek look like you do now? But this time, you were in Orion's past with us when the historians had the time vortex replay Vulcan history. You couldn't be in two places at once, so you died as a boy. Guardian! Did you hear that? Is it possible for Spock to return to Vulcan and repair the timeline that has been broken so all is the same as before? You have to remember, for you and your mother to live. You've got it. I'll order the wardrobe section to prepare it now. Nice to know the crew is efficient in this time plane, too. Spock. I sent the others up to the ship. What happened? A pet? Well, that wouldn't mean much in the course of time. Enterprise, this is the Captain. Two to beam up. Welcome aboard, Mister Spock."
18,TAS,episode 1,SPOCK,"Captain, I have come to the conclusion that this is not a game. It seems, Captain, I am the only one affected. The mission, the ship, the crew, except for myself, remain the same. That is not correct. I wish to ask a question. What of Sarek's family, his wife and son? My mother. The son, what was his name and age when he died? What time period? The kahs-wan, a survival test traditional for young males. The twentieth day of Tasmeen. That was the day my cousin saved my life in the desert when I was attacked by a wild animal. I do not recall clearly. I was very young. He called himself Selek. He was visiting us, but I never saw him after that. I believe so, Captain. And I know what you're thinking. It was I who saved myself that other time. I do not remember everything. There is a vague memory from a child's point of view, but the details are not clear. Yes. I will need a Vulcan desert soft suit and boots, and a small selection of streetwear circa 8877 Vulcan years. The carry bag should be of the same period. Andorians are not known for their charity. And you in yours, Commander Thelin. I wish to visit the planet Vulcan, thirty years past, the month of Tasmeen. Location, near the city of ShirKahr. That is not true. My father 2 In the family, all is silence. No more will be said of it. Live long and prosper, Sarek of Vulcan. My name is Selek, an humble cousin descended of T'Pel and Sasak. I am journeying to the family shrine to honour our gods. I am honoured. Is something wrong, Cousin? A family resemblance to our forefathers, no doubt. Yes, father. Yes, father. Yes, father. No, my lady Amanda. Any child has much to learn. My young cousin has a more difficult road to travel than others. It is difficult for a father to bear less than perfection in his son. Spock will find his way. The boy goes through the kahs-wan ordeal soon, does he not? But tomorrow is the twentieth day of Tasmeen. I seem to have lost track of time. What if I do, father? I-Chaya. what if I'm not a true Vulcan like they say? Personal log, stardate 5373.9, subjective time. The timeline seems to have changed again. Yet I do not believe I have done anything to disrupt it. My memory is quite clear regarding the date my cousin saved my life, and it is tomorrow. The kahs-wan ordeal is an ancient rite of warrior days. When Vulcans turned to logic, they reasoned they must maintain the tests of courage and strength to keep pure logic from making them weak and helpless. Y No, I-Chaya, this is my own test. I have to do it alone. Stay. Of course. I should have remembered. It wasn't the actual kahs-wan ordeal. Y I-Chaya, go home. You are too old and too fat for this. That's how you always get around mother, but it does not work with me. Go home, I-Chaya. Personal log. The boy Spock should be moving toward the Llangon Mountains. He, I had much to prove to myself. The personal ordeal upon which I embarked was meant to determine the course my life would take. I-Chaya, good boy. I suggest we move away from this area before the le-matya regains consciousness. Y Thank you for helping me and I-Chaya. It was my duty, Spock. Y Mother says you should always say thank you. The lady Amanda is known for her graciousness.  Y Do you think I'll ever be able to do that neck pinch as well as you? I dare say you will. Come now. Y You followed me. Why? I suspected you would go. You are worried about the kahs-wan ordeal. Y I had to see if I could do it. A personal test. I cannot fail. That is your father's wish? Y Yes, and my mother's. They, they confuse me. Father wants me to do things his way, and Mother says I should. But then she goes She is a human woman, with strong emotion and sensitivities. She embarrasses you with those traits, and you are afraid when you see them in yourself. Y How did you know? There is some human blood in my family line. It is not fatal. What you do not yet understand, Spock, is that Vulcans do not lack emotion. It is only that ours is controlled. Logic offers a serenity humans seldom experience in full. We have emotions but we deal with them and do not let them control us. Y I-Chaya! The le-matya struck him with its poison claws in the fight. Y Is he dying? Yes. Personal log. Something unexpected has again occurred. The sehlat, I-Chaya, was struck by the poisonous claws of the le-matya he fought. He is dying, unless we can find a healer, and soon. We cannot get him back to the city to a healer. He is too large to move. Y Then what? You are a Vulcan. What is the logical thing to do? Y I can bring a healer here. It is a long journey across the desert. There are many dangers. I will go. Y No. This is my duty. No one else can do it for me. Will you stay with him? This did not happen before. My life decision was made without the sacrifice of yours, old friend. I know there is pain. I can help a little. Sleep now. Most urgent, Healer. My sehlat fought a le-matya in the Llangon foothills. He suffered a small wound, but the poison of its claws is working in him now. Please, you must come with me. He needs your healing. Yes, Healer. I did that once, two years ago. Healer, I would not call you out unless a life was in danger. Have you ever heard the son of Sarek was a liar? Healer, please hurry. It will not be long now, old friend. You made the desert crossing most efficiently. You will not disappoint Sarek in your kahs-wan. Y I wanted only to help I-Chaya. He was my father's before he was mine. To lose him A Vulcan would face such a loss without tears. Y How? By understanding every life comes to an end when time demands it. Loss of life is to be mourned but only if the life was wasted. I-Chaya's was not. Yes, sir? Is there nothing you can do? Release him. It is fitting he dies with peace and dignity. Y I regret having troubled you in any way, but it was necessary. There was a decision to be made. A direction for my life had to be chosen. I chose Vulcan. Thank you, father. If you will excuse me now, I have some business to conduct with schoolmates. A demonstration of the Vulcan neck pinch. Our cousin taught me. I too must make my farewells. Your hospitality has been most kind, but I must journey on. Try to understand your son, Sarek of Vulcan. It will be repayment enough for me. I think I shall not. Peace and long life. One small thing was changed this time. A pet died. It might, to some. Doctor McCoy, you do not know your good fortune. IF the times were different, you would have to recalibrate for an Andorian. Times change, Doctor. Times change. <Back to the episode listingStar Trek ® and related marks are trademarks of Studios Inc. Copyright © 1966, Present. The Star Trek web pages on this site are for educational and entertainment purposes only. All other copyrights property of their respective holders."
19,TAS,episode 1,UHURA,
20,TAS,episode 1,ENGINEER,
21,TAS,episode 1,CBS,
22,TAS,episode 1,BATES,"Sir, we've checked the Starfleet records Commander Thelin asked for. There is no Vulcan named Spock serving with the Starfleet in any capacity. Yes, sir. I can relay that to your screen. Sarek of Vulcan. Ambassador to seventeen Federation planets in the past thirty years. Amanda, wife of Sarek. Born on Earth as Amanda Grayson. The couple separated after the death of their son. The wife was killed in a shuttle accident at Lunaport on her way home to Earth. Ambassador Sarek has not remarried. Spock. Age seven."
23,TAS,episode 1,ERIKSON,Nothing. I can't find one thing we did when we were in the vortex that could possibly have affected the future.
24,TAS,episode 1,GUARDIAN,"I hear all. It is possible if no other major factor is changed. The time and place are ready to receive you. Personal log, stardate 5373.5, subjective time. I have returned to the past in an attempt to restore the future. I am home and I had almost forgotten its beauty. The traveller is returning."
25,TAS,episode 1,HEALER,"The hour is late. I trust your errand is urgent? Y You are Spock, son of Sarek, are you not? Y I have heard of you. I have heard of a tendency toward what humans call practical jokes. Y No. That has never been said. Very well. Wait here and I will get my medicines. Y Spock. Y It has been too long. No antidote known will save his life. Y I can prolong his life, but he will be in pain. Or I can release him from life. I will need your decision. He is your pet. Y"
26,TAS,episode 1,AMANDA,"I hope you were not disturbed by my son's behaviour, Selek. You seem to understand him better than my husband. I hops so. I respect Vulcan and all its traditions, but it is a demanding life. Next month. Yes. Is something wrong? Sarek, our son and the visitor are gone. You don't think he'd harm Spock?"
27,TAS,episode 1,GREY,"Cease review. Yes, but it was nothing unusual. We were scanning recent Vulcan history. Twenty to thirty Vulcan years past."
28,TAS,episode 1,BOY,"Earther! Barbarian! Emotional Earther! You're a Terran, Spock. You could never be a true Vulcan. Y Your father brought shame to Vulcan. He married a human. You haven't even mastered a simple Vulcan neck pinch yet, Earther."
